{
  "bundleSha256": "8b13e559b40c3e096772d3e017c3fb60d89d2b6b3e96fe22e1b1805b2688c25a",
  "bundleSizeBytes": 178732208,
  "bundleUrl": "https://github.com/retrom-project/retrom-runtime/releases/download/v0.43.1/emulatorjs-provider-2.20.0.tar.gz",
  "commit": "218d9c43cf54f638e529647149afd18d02507e39",
  "fileCount": 195,
  "manifestSha256": "cd09f64a81f30710ad5f9c04169e761f1ae29146b88ca8219312be04ed08770d",
  "providerId": "emulatorjs",
  "providerVersion": "2.20.0",
  "repository": "https://github.com/retrom-project/retrom-runtime",
  "schemaVersion": 1,
  "tag": "v0.43.1",
  "unpackedSizeBytes": 182794458
}
