{
  "bundleSha256": "d49b68679922822f139837780ab3f25bacb8fc04f60b7b6e77a652949a14e5e9",
  "bundleSizeBytes": 301614857,
  "bundleUrl": "https://github.com/retrom-project/retrom-runtime/releases/download/v0.47.0/retrom-runtime-provider-0.47.0.tar.gz",
  "commit": "200b68ebbfea84489b3e21e4aa946c8778fb2ff6",
  "fileCount": 408,
  "manifestSha256": "59b6fcf4f514987e4e54dc99768f6eca6423f101c9359e411ad1d9437c319e0d",
  "providerId": "retrom-runtime",
  "providerVersion": "0.47.0",
  "repository": "https://github.com/retrom-project/retrom-runtime",
  "schemaVersion": 1,
  "tag": "v0.47.0",
  "unpackedSizeBytes": 668475848
}
